{
  "schemaVersion": "0.0.1",
  "id": "1002",
  "name": "tacc-stampede2-storage",
  "description": "WIP: Sample storage resource for TACC Stampede2 Cluster",
  "resourceType": "STORAGE",
  "host": "stampede2.tacc.xsede.org",
  "connection": {
    "connectionProtocol": "SSH",
    "securityProtocol": "SSHKEYS",
    "port": 22
  },
  "resource": {
    "storageType": "POSIX",
    "fileSystem": {
      "rootDir": "/",
      "scratchDir": "/scratch"
    }
  }
}
