{
  "schemaVersion": "0.0.1",
  "id": "1001",
  "name": "tacc-stampede2-compute",
  "description": "WIP: Sample compute resource for TACC Stampede2 Cluster",
  "resourceType": "COMPUTE",
  "host": "stampede2.tacc.xsede.org",
  "connection": {
    "connectionProtocol": "SSH",
    "securityProtocol": "SSHKEYS",
    "port": 22
  },
  "resource": {
    "schedulerType": "FORK",
    "storageResource": {
      "storageType": "POSIX",
      "fileSystem": {
        "rootDir": "/",
        "scratchDir": "/scratch"
      }
     },
    "forkSystem": {
      "systemType": "LINUX"
    }
  }
}
