{
  "schemaVersion": "0.0.1",
  "id": "1001",
  "name": "tacc-stampede2-compute",
  "description": "WIP: Sample compute resource for TACC Stampede2 Cluster",
  "resourceType": "COMPUTE",
  "host": "stampede2.tacc.xsede.org",
  "resource": {
    "schedulerType": "BATCH",
    "connection": {
      "connectionProtocol": "SSH",
      "securityProtocol": "SSHKEYS",
      "port": 22
    },
    "storageType": "POSIX",
      "fileSystem": {
        "rootDir": "/",
        "scratchDir": "/scratch",
        "workDir": "/work",
        "homeDir": "/home"
      },
    "batchSystem": {
      "jobManager": "SLURM",
      "commandPaths": [
        {
          "name": "SUBMISSION"
        }],
        "partitions": [
          {
            "name": "normal",
            "totalNodes": 256,
            "nodeHardware": {
              "cpuType": "KNL CPUs @ 1.40GHz",
              "cpuCount": 68,
              "memoryType": "DDR4",
              "memorySize": "96 GB"
            
            }
          }
        ]
      }
  }
}

